{
  "id": "review-trial-findings",
  "title": "Review trial findings",
  "description": "Review actual usage signals and choose one next friction reduction.",
  "assignee_human_id": "chad",
  "status": "not_started",
  "acceptance_criteria": "trial findings reviewed",
  "acceptance_signals": [
    {
      "id": "sig-review",
      "category": "command",
      "required": false,
      "success_condition": "review completed",
      "command": "review artifact"
    }
  ],
  "depends_on": [
    "validate-real-work-capture"
  ],
  "last_activity_at": "2026-03-19T21:08:05.786Z"
}
