{
  "id": "validate-signal-visibility",
  "title": "Validate signal visibility follow-up",
  "description": "Use task status and next-step hints to drive the local check/test loop without external signal lookup.",
  "assignee_human_id": "chad",
  "status": "ready_for_review",
  "acceptance_criteria": "check passes and tests pass",
  "acceptance_signals": [
    {
      "id": "sig-check",
      "category": "command",
      "required": true,
      "success_condition": "npm run check exits 0",
      "command": "npm run check"
    },
    {
      "id": "sig-tests",
      "category": "test",
      "required": true,
      "success_condition": "npm test passes",
      "pattern": "vitest"
    }
  ],
  "depends_on": [],
  "last_activity_at": "2026-03-19T21:41:52.713Z"
}
